{
  "schema_version": "0.1-draft",
  "name": "level-0-example",
  "description": "Minimal AKBP file convention example",
  "root": ".",
  "artifacts": {
    "wiki": "wiki/",
    "claims": "claims/claims.jsonl",
    "entities": "graph/entities.jsonl",
    "relations": "graph/relations.jsonl",
    "sources": "raw/sources/",
    "audit": ".akbp/audit.log.jsonl"
  },
  "capabilities": {
    "remember": true,
    "retrieve": true,
    "crystallize": false,
    "supersede": false,
    "audit": true,
    "sync": false
  },
  "retrieval": ["keyword"],
  "transports": ["cli"],
  "privacy": {
    "default_scope": "project",
    "secret_redaction": "required"
  }
}
