{
  "schema_version": "0.1-draft",
  "name": "level-3-example",
  "description": "AKBP lifecycle relations example with concrete JSONL records",
  "root": ".",
  "artifacts": {
    "wiki": "wiki/",
    "claims": "claims/claims.jsonl",
    "entities": "graph/entities.jsonl",
    "relations": "graph/relations.jsonl",
    "sources": "raw/sources/",
    "audit": ".akbp/audit.log.jsonl"
  },
  "capabilities": {
    "remember": true,
    "retrieve": true,
    "crystallize": false,
    "supersede": true,
    "audit": true,
    "sync": false
  },
  "retrieval": [
    "keyword",
    "jsonl"
  ],
  "transports": [
    "cli"
  ],
  "privacy": {
    "default_scope": "project",
    "secret_redaction": "required"
  }
}
